<?xml version="1.0" encoding="UTF-8"?>
<!DOCTYPE projects SYSTEM "Test07.dtd">

<projects>
<student name="홍길동" gender="man" email="hong" />
<student name="임꺽정" gender="man" email="leem" />
<student name="유관순" gender="man" email="yoo" />
<student name="김원봉" gender="man" email="kim" />
<student name="김구" gender="man" email="kimgu" />
<student name="안중근" gender="man" email="ahn" />
<student name="윤봉길" gender="man" email="yoon" 
		 tel="111-1111 222-2222 333-3333" />
		
<!-- <project title="프로젝트1" owner="hon" /> 
	오류! hon 이라는 ID가 존재하지 않는다 -->
<project title="프로젝트2" owner="hong" members="hong kim"/>
<project title="프로젝트3" owner="hong" members="hong kim"/>
<project title="프로젝트3" owner="hong" members="hong kim leem"/>
</projects>